{
  "schemaVersion": "1.0.0",
  "contentVersion": "1.0.0",
  "language": "en-GB",
  "contentNotice": "Original retelling based on the cited Bible passages; not a replacement for reading Scripture.",
  "story": {
    "id": "joshua-jericho",
    "title": "Joshua and Jericho",
    "subtitle": "Faith that brought walls down",
    "collectionIds": [
      "heroes-of-faith"
    ],
    "scriptureReferences": [
      "Joshua 1:1–18",
      "Joshua 2:1–24",
      "Joshua 3:1–17",
      "Joshua 5:13–15",
      "Joshua 6:1–27"
    ],
    "illustration": "stories/joshua-jericho.svg",
    "estimatedMinutes": 9,
    "difficulty": "beginner",
    "ageSuitability": "all-ages",
    "featured": true,
    "keywords": [
      "Joshua",
      "Jericho",
      "Rahab",
      "courage",
      "obedience",
      "promised land",
      "faith"
    ],
    "introduction": {
      "summary": "Joshua leads Israel across the Jordan and follows God’s unusual instructions at Jericho, while Rahab’s courageous faith brings rescue to her household.",
      "context": "After Moses dies, Joshua must lead a new generation into the promised land. Jericho is the first fortified city they encounter west of the Jordan."
    },
    "storySections": [
      {
        "id": "be-strong-and-courageous",
        "title": "Be Strong and Courageous",
        "content": "God appoints Joshua to lead Israel after Moses. The task is enormous, but Joshua is told to be strong, courageous and careful to follow God’s instruction. His confidence must rest on God’s presence rather than his own experience.",
        "scriptureReference": "Joshua 1:1–9"
      },
      {
        "id": "rahab-and-the-spies",
        "title": "Rahab and the Spies",
        "content": "Joshua sends two spies into Jericho. Rahab hides them from the king’s men because she believes Israel’s God rules heaven and earth. She asks that her family be protected, and the spies give her a scarlet cord as the sign of their agreement.",
        "scriptureReference": "Joshua 2:1–24"
      },
      {
        "id": "crossing-the-jordan",
        "title": "Crossing the Jordan",
        "content": "The Jordan is overflowing, yet the priests step into the water carrying the covenant ark. The river stops, and the entire nation crosses on dry ground. The crossing confirms Joshua’s leadership and reminds Israel that God goes before them.",
        "scriptureReference": "Joshua 3:1–17"
      },
      {
        "id": "the-lords-commander",
        "title": "The Lord’s Commander",
        "content": "Near Jericho, Joshua encounters the commander of the Lord’s army. Joshua learns that the central question is not whether God supports Joshua’s plans, but whether Joshua stands reverently under God’s authority.",
        "scriptureReference": "Joshua 5:13–15"
      },
      {
        "id": "walls-fall",
        "title": "The Walls Fall",
        "content": "Israel marches around Jericho in silence for six days. On the seventh day they circle it seven times; priests sound their trumpets and the people shout. The walls collapse, the city is taken, and Rahab’s household is brought to safety.",
        "scriptureReference": "Joshua 6:1–27"
      }
    ],
    "keyPeople": [
      {
        "name": "Joshua",
        "role": "Successor to Moses and leader of Israel"
      },
      {
        "name": "Rahab",
        "role": "Woman of Jericho whose faith protects the spies and her family"
      },
      {
        "name": "The priests",
        "role": "Carriers of the covenant ark and trumpets"
      }
    ],
    "keyLocations": [
      {
        "name": "Jordan River",
        "description": "The river Israel crossed on dry ground"
      },
      {
        "name": "Jericho",
        "description": "A fortified city at the entrance to the promised land"
      }
    ],
    "flashcards": [
      {
        "id": "joshua-card-1",
        "front": "Who succeeded Moses as Israel’s leader?",
        "back": "Joshua, son of Nun, was commissioned to lead Israel.",
        "scriptureReference": "Joshua 1:1–2"
      },
      {
        "id": "joshua-card-2",
        "front": "What repeated command did Joshua receive?",
        "back": "He was told to be strong and courageous.",
        "scriptureReference": "Joshua 1:6–9"
      },
      {
        "id": "joshua-card-3",
        "front": "Who protected the spies in Jericho?",
        "back": "Rahab hid the spies and helped them escape.",
        "scriptureReference": "Joshua 2:1–16"
      },
      {
        "id": "joshua-card-4",
        "front": "What marked Rahab’s house?",
        "back": "A scarlet cord placed in her window.",
        "scriptureReference": "Joshua 2:17–21"
      },
      {
        "id": "joshua-card-5",
        "front": "How many days did Israel march around Jericho?",
        "back": "They marched for seven days, circling the city seven times on the final day.",
        "scriptureReference": "Joshua 6:3–4"
      },
      {
        "id": "joshua-card-6",
        "front": "What happened after the trumpets and shout?",
        "back": "Jericho’s wall collapsed and Israel entered the city.",
        "scriptureReference": "Joshua 6:20"
      }
    ],
    "keyLessons": [
      "Courage grows from confidence in God’s presence.",
      "Faith can emerge in unexpected people and places.",
      "Obedience sometimes requires action before the outcome is visible.",
      "God’s victories must never become grounds for personal pride."
    ],
    "reflection": {
      "question": "Where do you need courage to follow a clear instruction even when the method feels unfamiliar?",
      "prompt": "Write one faithful step you can take instead of waiting for all uncertainty to disappear."
    },
    "prayerPrompt": "God who goes before your people, give me courage, humility and a willing heart to obey.",
    "quiz": [
      {
        "id": "joshua-question-1",
        "question": "Who became Israel’s leader after Moses?",
        "options": [
          "Caleb",
          "Aaron",
          "Joshua",
          "Samuel"
        ],
        "correctOptionIndex": 2,
        "explanation": "God commissioned Joshua to lead Israel across the Jordan.",
        "scriptureReference": "Joshua 1:1–2"
      },
      {
        "id": "joshua-question-2",
        "question": "Where did Rahab hide the spies?",
        "options": [
          "In a cave",
          "Under stalks of flax on her roof",
          "Inside the city gate",
          "In a well"
        ],
        "correctOptionIndex": 1,
        "explanation": "Rahab concealed the spies beneath flax spread on her roof.",
        "scriptureReference": "Joshua 2:6"
      },
      {
        "id": "joshua-question-3",
        "question": "What happened when the priests stepped into the Jordan?",
        "options": [
          "A bridge appeared",
          "The water stopped so Israel could cross",
          "The priests returned to camp",
          "A storm began"
        ],
        "correctOptionIndex": 1,
        "explanation": "The river was cut off upstream and the people crossed on dry ground.",
        "scriptureReference": "Joshua 3:14–17"
      },
      {
        "id": "joshua-question-4",
        "question": "How many times did Israel circle Jericho on the seventh day?",
        "options": [
          "One",
          "Three",
          "Seven",
          "Twelve"
        ],
        "correctOptionIndex": 2,
        "explanation": "They circled seven times before the priests sounded the trumpets.",
        "scriptureReference": "Joshua 6:15–16"
      },
      {
        "id": "joshua-question-5",
        "question": "Whose household was rescued from Jericho?",
        "options": [
          "Achan’s",
          "Rahab’s",
          "The king’s",
          "Joshua’s"
        ],
        "correctOptionIndex": 1,
        "explanation": "Joshua honoured the spies’ promise and brought Rahab’s family to safety.",
        "scriptureReference": "Joshua 6:22–25"
      }
    ],
    "completion": {
      "points": 130,
      "achievementId": "bible-explorer",
      "nextStoryId": "ruth"
    }
  }
}
